{
  "schemaVersion": 1,
  "kind": "prd",
  "profile": "implementation",
  "id": "feature-documents",
  "revision": "1",
  "title": "Specifications for reading and execution",
  "summary": "JSON expresses the requirements. A readable document explains them. Focused context supports delivery of each task.",
  "locale": "en",
  "techPlan": {
    "id": "feature-documents-plan",
    "revision": "1"
  },
  "goals": [
    "Reduce writing and review of repetitive structures.",
    "Make decisions, requirements and their evidence easy to find."
  ],
  "users": [
    "Feature owners reviewing and approving a feature.",
    "Agents implementing a task with the relevant context."
  ],
  "outOfScope": [
    "A hosted collaborative editor.",
    "Automatic publication or deployment."
  ],
  "constraints": [
    "Reading a document requires no hosted service.",
    "No automatic commits, pushes or publication.",
    "Planned checks are never presented as observed results."
  ],
  "requirements": [
    {
      "id": "FR-001",
      "kind": "functional",
      "title": "A standalone document",
      "description": "Open the PRD from a local file without a server or network access.",
      "priority": "must",
      "acceptance": [
        "Text and diagrams remain readable offline.",
        "Navigation works with the keyboard."
      ]
    },
    {
      "id": "FR-002",
      "kind": "functional",
      "title": "JSON as the single source",
      "description": "Generate headings, references and dependencies without writing a second document.",
      "priority": "must",
      "acceptance": [
        "No prd.md file is required.",
        "Unknown references and cycles are rejected."
      ]
    },
    {
      "id": "FR-003",
      "kind": "functional",
      "title": "Relevant context for each task",
      "description": "Extract the requirements and contracts needed for a single task.",
      "priority": "must",
      "acceptance": [
        "Global constraints are preserved.",
        "Transitive technical references are included."
      ]
    },
    {
      "id": "FR-004",
      "kind": "functional",
      "title": "Evidence separate from the plan",
      "description": "Attach observed results to the exact approved revision.",
      "priority": "must",
      "acceptance": [
        "An edited PRD invalidates the previous execution record.",
        "A check that has not run remains marked as planned."
      ]
    },
    {
      "id": "FR-005",
      "kind": "functional",
      "title": "Reproducible pull request preparation",
      "description": "Collect the diff, fill in the template and check scope before publication.",
      "priority": "must",
      "acceptance": [
        "Tests without evidence are not reported as passing.",
        "Planning documents are detected before publication."
      ]
    },
    {
      "id": "FR-006",
      "kind": "functional",
      "title": "Reliable review mechanics",
      "description": "Prepare the diff once and aggregate structured reviewer responses.",
      "priority": "must",
      "acceptance": [
        "A missing or malformed response remains visible.",
        "Lines outside the diff are not presented as anchored comments."
      ]
    },
    {
      "id": "NFR-001",
      "kind": "non-functional",
      "title": "Accessible and comfortable reading",
      "description": "The reader adapts to narrow screens and printing. Controls have visible focus and content does not depend on animation.",
      "priority": "must",
      "acceptance": [
        "No horizontal page overflow at 375 px.",
        "Text remains readable at 200% zoom.",
        "Printing includes collapsed details."
      ]
    }
  ],
  "tasks": [
    {
      "id": "CODE-001",
      "kind": "code",
      "title": "Define the document contract",
      "goal": "Validate identifiers, references and the graph.",
      "dependsOn": [],
      "requirementIds": [
        "FR-002"
      ],
      "planRefs": [
        "DEC-001"
      ],
      "scope": [
        "schemas/",
        "scripts/document-model.mjs"
      ],
      "validation": [
        "Exercise a cycle and an unknown reference."
      ],
      "seedIds": []
    },
    {
      "id": "CODE-002",
      "kind": "code",
      "title": "Build the HTML reader",
      "goal": "Produce a standalone, accessible view.",
      "dependsOn": [
        "CODE-001"
      ],
      "requirementIds": [
        "FR-001",
        "NFR-001"
      ],
      "planRefs": [
        "FLOW-001"
      ],
      "scope": [
        "assets/",
        "scripts/document-view.mjs",
        "scripts/reader.mjs"
      ],
      "validation": [
        "Open offline, navigate with the keyboard and print."
      ],
      "seedIds": []
    },
    {
      "id": "CODE-003",
      "kind": "code",
      "title": "Extract context and track evidence",
      "goal": "Link excerpts and results to source documents.",
      "dependsOn": [
        "CODE-001"
      ],
      "requirementIds": [
        "FR-003",
        "FR-004"
      ],
      "planRefs": [
        "CALC-001"
      ],
      "scope": [
        "scripts/execution.mjs",
        "scripts/prd.mjs"
      ],
      "validation": [
        "Reject a stale technical plan.",
        "Preserve transitive references."
      ],
      "seedIds": []
    },
    {
      "id": "CODE-004",
      "kind": "code",
      "title": "Automate pull request preparation",
      "goal": "Build a description from a fixed Git snapshot.",
      "dependsOn": [
        "CODE-003"
      ],
      "requirementIds": [
        "FR-005"
      ],
      "planRefs": [
        "DEC-002"
      ],
      "scope": [
        "draft-pr/scripts/"
      ],
      "validation": [
        "Use a temporary repository with a stacked branch."
      ],
      "seedIds": []
    },
    {
      "id": "CODE-005",
      "kind": "code",
      "title": "Automate Argus review mechanics",
      "goal": "Validate and aggregate without hiding errors.",
      "dependsOn": [],
      "requirementIds": [
        "FR-006"
      ],
      "planRefs": [
        "CTR-002"
      ],
      "scope": [
        "argus-review/scripts/"
      ],
      "validation": [
        "Exercise a missing response and a line outside the diff."
      ],
      "seedIds": []
    },
    {
      "id": "QA-001",
      "kind": "human-qa",
      "title": "Review the document end to end",
      "dependsOn": [
        "CODE-002",
        "CODE-003",
        "CODE-004",
        "CODE-005"
      ],
      "requirementIds": [
        "FR-001",
        "NFR-001"
      ],
      "planRefs": [],
      "seedIds": [],
      "steps": [
        "Open the HTML on a desktop and then on a narrow screen.",
        "Follow a requirement to its task and check.",
        "Switch to the dark theme, then print."
      ],
      "expected": "The document remains understandable without knowing its JSON structure.",
      "cleanup": "Close the demonstration files."
    }
  ],
  "checks": [
    {
      "id": "CHECK-001",
      "requirementIds": [
        "FR-001"
      ],
      "scenario": "Text and diagrams remain readable offline.",
      "route": "runtime",
      "expected": "Navigation works with the keyboard.",
      "seedIds": []
    },
    {
      "id": "CHECK-002",
      "requirementIds": [
        "FR-002"
      ],
      "scenario": "No prd.md file is required.",
      "route": "runtime",
      "expected": "Unknown references and cycles are rejected.",
      "seedIds": []
    },
    {
      "id": "CHECK-003",
      "requirementIds": [
        "FR-003"
      ],
      "scenario": "Global constraints are preserved.",
      "route": "runtime",
      "expected": "Transitive technical references are included.",
      "seedIds": []
    },
    {
      "id": "CHECK-004",
      "requirementIds": [
        "FR-004"
      ],
      "scenario": "An edited PRD invalidates the previous execution record.",
      "route": "runtime",
      "expected": "A check that has not run remains marked as planned.",
      "seedIds": []
    },
    {
      "id": "CHECK-005",
      "requirementIds": [
        "FR-005"
      ],
      "scenario": "Tests without evidence are not reported as passing.",
      "route": "runtime",
      "expected": "Planning documents are detected before publication.",
      "seedIds": []
    },
    {
      "id": "CHECK-006",
      "requirementIds": [
        "FR-006"
      ],
      "scenario": "A missing or malformed response remains visible.",
      "route": "runtime",
      "expected": "Lines outside the diff are not presented as anchored comments.",
      "seedIds": []
    },
    {
      "id": "CHECK-007",
      "requirementIds": [
        "NFR-001"
      ],
      "scenario": "No horizontal page overflow at 375 px.",
      "route": "manual",
      "expected": "Printing includes collapsed details.",
      "seedIds": []
    }
  ],
  "seeds": [],
  "risks": [
    {
      "id": "RISK-001",
      "kind": "risk",
      "description": "An overly detailed schema could increase the amount of writing.",
      "mitigation": "Keep explanations in prose and measure excerpts on a representative case.",
      "status": "open"
    },
    {
      "id": "NOTE-001",
      "kind": "assumption",
      "description": "This document demonstrates rendering. Displayed checks are planned checks, not delivery results.",
      "status": "open"
    }
  ]
}
